{
  "schemaVersion": 1,
  "material3Version": "1.5.0-alpha26",
  "composeUiVersion": "1.12.0-alpha03",
  "stableBaseline": "1.4.0",
  "reviewedOn": "2026-07-16",
  "entries": [
    {
      "id": "buttons",
      "officialName": "Buttons",
      "aliases": ["expressive buttons", "morphing buttons", "filled button", "tonal button", "hold to confirm", "fluid toggle group"],
      "kind": "component",
      "category": "Actions",
      "summary": "Official button styles plus project expressive variants for spring-shaped presses, loading, hold-to-confirm, rejected actions, and fluid toggle groups.",
      "guidance": {
        "purpose": "Trigger an immediate action with emphasis proportional to its importance.",
        "useWhen": ["The user can perform a clear verb such as Save, Continue, or Delete.", "A primary, secondary, or low-emphasis action needs an explicit label."],
        "avoidWhen": ["The control changes a persistent selected state; use a toggle button or selection control.", "Navigation is the primary purpose; use the appropriate navigation component."],
        "behavior": ["Pressed feedback begins immediately and never delays the action.", "Loading replaces or accompanies the label without changing the button's meaning or location.", "Destructive or consequential actions require proportionate confirmation."],
        "accessibility": ["Use a concise verb label and preserve a minimum accessible touch target.", "Expose loading, disabled, and hold progress as semantic state descriptions."],
        "adaptive": ["Allow labels to grow for translated and large text instead of forcing fixed widths.", "Reflow peer actions vertically when the available width cannot preserve readable labels."]
      },
      "collections": ["featured", "expressive", "recent"],
      "demoKey": "actions.buttons",
      "sourceLocations": [{"path":"material-app/samples/actions/src/main/java/dev/qtremors/material/samples/actions/ActionSamples.kt","symbols":["ButtonsSample","ExpressiveActionButton","HoldToConfirmButton","FluidToggleButtonGroup","RejectedActionButton"]}],
      "apiReferences": [
        {"symbol":"androidx.compose.material3.Button","artifact":"androidx.compose.material3:material3","reviewedVersion":"1.5.0-alpha26","availability":"stable_artifact","stability":"stable","url":"https://developer.android.com/reference/kotlin/androidx/compose/material3/package-summary"},
        {"symbol":"androidx.compose.material3.LoadingIndicator","artifact":"androidx.compose.material3:material3","reviewedVersion":"1.5.0-alpha26","availability":"alpha_only","stability":"experimental","optInAnnotation":"androidx.compose.material3.ExperimentalMaterial3ExpressiveApi","url":"https://developer.android.com/reference/kotlin/androidx/compose/material3/LoadingIndicator"}
      ],
      "officialUrls": ["https://m3.material.io/components/buttons/overview"],
      "implementation": "project_implementation",
      "addedIn": "2.0.0",
      "reviewedOn": "2026-07-15"
    },
    {
      "id": "split-buttons",
      "officialName": "Split buttons",
      "aliases": ["split button", "combined action", "dropdown action"],
      "kind": "component",
      "category": "Actions",
      "summary": "A leading primary action paired with a trailing control for related choices.",
      "guidance": {
        "purpose": "Keep a frequent default action adjacent to a menu of closely related alternatives.",
        "useWhen": ["One action is the expected default and alternatives share the same object and outcome family.", "Repeating the default action should require one tap."],
        "avoidWhen": ["Every choice is equally important; use a menu, button group, or separate actions.", "The trailing menu would contain unrelated overflow commands."],
        "behavior": ["The leading region immediately performs the default action.", "The trailing region opens and closes a labelled menu without triggering the default action."],
        "accessibility": ["Give each region a distinct accessible name and touch target.", "Announce whether the alternatives menu is expanded."],
        "adaptive": ["Preserve both touch targets at compact widths and shorten the visible label only when its meaning remains clear."]
      },
      "collections": ["featured", "expressive"],
      "demoKey": "actions.split-buttons",
      "sourceLocations": [{"path":"material-app/samples/actions/src/main/java/dev/qtremors/material/samples/actions/ActionSamples.kt","symbols":["SplitButtonsSample"]}],
      "apiReferences": [{"symbol":"androidx.compose.material3.SplitButton","artifact":"androidx.compose.material3:material3","reviewedVersion":"1.5.0-alpha26","availability":"alpha_only","stability":"experimental","optInAnnotation":"ExperimentalMaterial3ExpressiveApi","url":"https://developer.android.com/reference/kotlin/androidx/compose/material3/package-summary"}],
      "officialUrls": ["https://m3.material.io/components/split-button/overview"],
      "implementation": "official_api",
      "addedIn": "2.0.0",
      "reviewedOn": "2026-07-15"
    },
    {
      "id": "floating-action-buttons",
      "officialName": "Floating action buttons",
      "aliases": ["fab", "extended fab", "floating action button"],
      "kind": "component",
      "category": "Actions",
      "summary": "High-emphasis actions that float above the main content of a screen.",
      "guidance": {
        "purpose": "Keep the screen's most important constructive action available above scrolling content.",
        "useWhen": ["A destination has one frequent, high-value action such as Create.", "The action benefits from remaining visible while content scrolls."],
        "avoidWhen": ["Several actions have equal priority.", "The action is destructive, uncommon, or already dominant in the app bar."],
        "behavior": ["The FAB remains visually tied to the current destination.", "Extended labels may collapse on scroll while the icon and meaning remain stable."],
        "accessibility": ["Use an unambiguous icon with an accessible name.", "Keep the FAB clear of system gestures, navigation, keyboards, and important content."],
        "adaptive": ["Reposition or replace the FAB when wider layouts provide a persistent action region.", "Account for navigation bars, rails, panes, and display cutouts."]
      },
      "collections": ["featured", "recent"],
      "demoKey": "actions.fabs",
      "sourceLocations": [{"path":"material-app/samples/actions/src/main/java/dev/qtremors/material/samples/actions/ActionSamples.kt","symbols":["FloatingActionButtonsSample"]}],
      "apiReferences": [{"symbol":"androidx.compose.material3.FloatingActionButton","artifact":"androidx.compose.material3:material3","reviewedVersion":"1.5.0-alpha26","availability":"stable_artifact","stability":"stable","url":"https://developer.android.com/reference/kotlin/androidx/compose/material3/FloatingActionButton"}],
      "officialUrls": ["https://m3.material.io/components/floating-action-button/overview"],
      "implementation": "official_api",
      "addedIn": "2.0.0",
      "reviewedOn": "2026-07-15"
    },
    {
      "id": "icon-buttons",
      "officialName": "Icon buttons",
      "aliases": ["icon toggle", "filled icon button", "tonal icon button", "outlined icon button"],
      "kind": "component",
      "category": "Actions",
      "summary": "Compact square tap targets for single icon actions and persistent toggles across standard, filled, tonal, and outlined emphasis.",
      "guidance": {
        "purpose": "Offer a compact action or persistent toggle whose meaning stays recognizable through the icon alone.",
        "useWhen": ["A common iconographic verb such as add, edit, share, or favorite needs a compact target.", "A selected state should persist and be visible on the control itself."],
        "avoidWhen": ["The meaning would be ambiguous without a text label.", "Several related choices compete for the same slot; prefer a menu or button group."],
        "behavior": ["Press feedback begins immediately and the target preserves its accessible size.", "Toggle variants switch state on press with clear checked visuals.", "Disabled icon buttons keep their layout space."],
        "accessibility": ["Give every icon button a precise content description and expose toggle state.", "Do not rely on color or shape alone to communicate checked state."],
        "adaptive": ["Preserve touch target size when horizontal space compresses.", "Group related icon buttons into toolbars instead of scattering them across wide layouts."]
      },
      "collections": ["recent"],
      "demoKey": "actions.icon-buttons",
      "sourceLocations": [{"path":"material-app/samples/actions/src/main/java/dev/qtremors/material/samples/actions/ActionSamples.kt","symbols":["IconButtonsSample"]}],
      "apiReferences": [
        {"symbol":"androidx.compose.material3.IconButton","artifact":"androidx.compose.material3:material3","reviewedVersion":"1.5.0-alpha26","availability":"stable_artifact","stability":"stable","url":"https://developer.android.com/reference/kotlin/androidx/compose/material3/IconButton"},
        {"symbol":"androidx.compose.material3.FilledIconButton","artifact":"androidx.compose.material3:material3","reviewedVersion":"1.5.0-alpha26","availability":"alpha_only","stability":"stable","url":"https://developer.android.com/reference/kotlin/androidx/compose/material3/FilledIconButton"},
        {"symbol":"androidx.compose.material3.FilledIconToggleButton","artifact":"androidx.compose.material3:material3","reviewedVersion":"1.5.0-alpha26","availability":"alpha_only","stability":"stable","url":"https://developer.android.com/reference/kotlin/androidx/compose/material3/FilledIconToggleButton"},